{
  "$schema": "https://json-schema.org/draft/2020-12/schema",
  "$id": "se/collection.v1",
  "title": "System Explorer collection page",
  "description": "One page of object summaries from a collection. Pagination is explicit: the server never silently truncates, the client never infers truncation. Shared $defs are duplicated from observation.schema.json deliberately so each schema file is standalone.",
  "type": "object",
  "required": ["schema", "host", "subsystem", "collection", "observed_at", "status", "source", "applied_limit", "next_cursor", "items"],
  "properties": {
    "schema": { "const": "se.collection/1" },
    "host": { "$ref": "#/$defs/host" },
    "subsystem": { "$ref": "#/$defs/subsystemName" },
    "collection": { "$ref": "#/$defs/subsystemName" },
    "observed_at": { "$ref": "#/$defs/utcTimestamp" },
    "status": { "enum": ["ok", "partial", "error"] },
    "errors": {
      "type": "array",
      "items": { "type": "string", "minLength": 1 }
    },
    "source": {
      "type": "object",
      "required": ["adapter", "interface", "reference_commands"],
      "properties": {
        "adapter": { "type": "string", "minLength": 1 },
        "interface": { "type": "string", "minLength": 1 },
        "method": { "type": "string" },
        "reference_commands": {
          "type": "array",
          "minItems": 1,
          "items": { "type": "string", "minLength": 1 }
        },
        "notes": { "type": "array", "items": { "type": "string" } }
      }
    },
    "filters": {
      "type": "object",
      "description": "The fact-equality filters that were applied, echoed back.",
      "additionalProperties": { "type": "string" }
    },
    "requested_limit": { "type": "integer", "minimum": 1 },
    "applied_limit": { "type": "integer", "minimum": 1 },
    "total": {
      "type": "integer",
      "minimum": 0,
      "description": "Total matching objects, when cheaply known."
    },
    "next_cursor": {
      "type": ["string", "null"],
      "description": "Opaque cursor for the next page; null when this page is the end."
    },
    "items": {
      "type": "array",
      "items": { "$ref": "#/$defs/objectSummary" }
    }
  },
  "$defs": {
    "host": {
      "type": "object",
      "required": ["machine_id", "hostname"],
      "properties": {
        "machine_id": { "type": "string", "pattern": "^[0-9a-f]{32}$" },
        "hostname": { "type": "string", "minLength": 1 },
        "container": { "type": "string", "minLength": 1 },
        "app": { "type": "string", "minLength": 1 }
      }
    },
    "subsystemName": {
      "type": "string",
      "pattern": "^[a-z][a-z0-9-]*$"
    },
    "objectId": {
      "type": "string",
      "pattern": "^[a-z][a-z0-9-]*:\\S+$"
    },
    "objectSummary": {
      "type": "object",
      "required": ["id", "type", "native_id", "facts"],
      "properties": {
        "id": { "$ref": "#/$defs/objectId" },
        "type": { "type": "string", "minLength": 1 },
        "native_id": { "type": "string", "minLength": 1 },
        "name": { "type": "string" },
        "facts": {
          "type": "object",
          "description": "Summary subset of the object's facts, chosen per collection for list rendering and agent triage."
        },
        "worst_opinion_level": {
          "enum": ["ok", "info", "warn", "critical"],
          "description": "Triage level for lists: ok = positively healthy, info = neutral/no opinion, warn/critical mirror the worst opinion derivable from this summary's own facts via the shared rule evaluator (src/system_explorer/agent/rules/). A rule needing a fact the summary does not carry evaluates on the full object only — a documented acquisition-cost decision per rule, never divergent thresholds."
        },
        "depth": {
          "type": "integer",
          "minimum": 0,
          "description": "Tree depth for naturally hierarchical collections (block devices, mounts). Structural observation data, not presentation."
        }
      }
    },
    "utcTimestamp": {
      "type": "string",
      "pattern": "^\\d{4}-\\d{2}-\\d{2}T\\d{2}:\\d{2}:\\d{2}(\\.\\d+)?Z$"
    }
  }
}
